{
  "specversion": "1.0",
  "id": "event-mini-game-0001",
  "source": "dot://mini-games/android",
  "type": "com.dot.activity.completed.v1",
  "time": "2026-08-11T12:00:00.000Z",
  "subject": "activity/game-round",
  "dataschema": "https://schemas.dot/event/v0.1/com.dot.activity.completed.v1.schema.json",
  "dot": {
    "protocolVersion": "0.1",
    "eventVersion": 1,
    "lane": "product",
    "privacyClass": "pseudonymous",
    "profile": "activity",
    "producer": {
      "app": "dot-mini-games",
      "appVersion": "1.0.0",
      "platform": "android"
    },
    "tenantId": "tenant-01",
    "sessionId": "session-01"
  },
  "data": {
    "actor": {
      "type": "user",
      "id": "pseudonymous-user"
    },
    "action": "completed",
    "object": {
      "type": "game.round",
      "id": "round-01"
    },
    "outcome": {
      "status": "success",
      "durationMs": 42000,
      "score": 850
    }
  }
}

