{
  "specversion": "1.0",
  "id": "event-document-0001",
  "source": "dot://document/ios",
  "type": "com.dot.operation.completed.v1",
  "time": "2026-08-11T12:01:00.000Z",
  "subject": "document/pseudonymous-document",
  "dataschema": "https://schemas.dot/event/v0.1/com.dot.operation.completed.v1.schema.json",
  "dot": {
    "protocolVersion": "0.1",
    "eventVersion": 1,
    "lane": "product",
    "privacyClass": "pseudonymous",
    "profile": "interaction",
    "producer": {
      "app": "dot-document",
      "appVersion": "1.0.0",
      "platform": "ios"
    }
  },
  "data": {
    "action": "exported",
    "object": {
      "type": "document",
      "id": "pseudonymous-document"
    },
    "outcome": {
      "status": "success",
      "durationMs": 320
    },
    "attributes": {
      "format": "dtms-v2"
    }
  }
}

